{
  "name": "htop",
  "description": "Installs htop",
  "long_description": "# DESCRIPTION\n\nInstalls [htop](http://htop.sourceforge.net/) an interactive process viewer for Linux.\n\n\n# REQUIREMENTS\n\n## Supported Platforms\n\nThe following platforms are supported by this cookbook, meaning that the recipes run on these platforms without error:\n\n* Ubuntu\n* Debian\n\n# RECIPES\n\n* `htop` - The default recipe.\n\n# USAGE\n\nThis cookbook installs htop if not present, and pulls updates if they are installed on the system.\n\n# ATTRIBUTES\n\nNone\n\n\n## Basic Settings\n\nNone\n\n\n## Contributing\n\n1. Fork it\n2. Create your feature branch (`git checkout -b my-new-feature`)\n3. Commit your changes (`git commit -am 'Added some feature'`)\n4. Push to the branch (`git push origin my-new-feature`)\n5. Create new Pull Request\n\n\n## License\n\n**chef-htop**\n\n* Freely distributable and licensed under the [MIT license](http://phlipper.mit-license.org/2011-2012/license.html).\n* Copyright (c) 2011-2012 Phil Cohen (github@phlippers.net) [![endorse](http://api.coderwall.com/phlipper/endorsecount.png)](http://coderwall.com/phlipper)\n* http://phlippers.net/\n",
  "maintainer": "Phil Cohen",
  "maintainer_email": "github@phlippers.net",
  "license": "MIT",
  "platforms": {
    "debian": ">= 0.0.0",
    "ubuntu": ">= 0.0.0"
  },
  "dependencies": {
  },
  "recommendations": {
  },
  "suggestions": {
  },
  "conflicting": {
  },
  "providing": {
  },
  "replacing": {
  },
  "attributes": {
  },
  "groupings": {
  },
  "recipes": {
    "htop": "Installs htop monitoring"
  },
  "version": "1.0.0"
}